{
  "fileFormatVersion": "0.4",
  "editableDocumentId": "document_phase2_demo",
  "revision": {
    "revisionId": "revision_000002",
    "sequence": 2
  },
  "document": {
    "schemaVersion": "0.4",
    "id": "phase1-complete-paywall",
    "revision": 1,
    "compatibility": {
      "requiredCapabilities": [
        {
          "name": "layout.scrollContainer",
          "version": "0.4"
        },
        {
          "name": "layout.stack",
          "version": "0.4"
        },
        {
          "name": "layout.sizing",
          "version": "0.4"
        },
        {
          "name": "layout.heightSizing",
          "version": "0.4"
        },
        {
          "name": "layout.outerInsets",
          "version": "0.4"
        },
        {
          "name": "navigation.screens",
          "version": "0.4"
        },
        {
          "name": "navigation.sheets",
          "version": "0.4"
        },
        {
          "name": "component.text",
          "version": "0.4"
        },
        {
          "name": "component.image",
          "version": "0.4"
        },
        {
          "name": "component.icon",
          "version": "0.4"
        },
        {
          "name": "component.featureList",
          "version": "0.4"
        },
        {
          "name": "component.productSelector",
          "version": "0.4"
        },
        {
          "name": "component.productCard",
          "version": "0.4"
        },
        {
          "name": "component.productBadge",
          "version": "0.4"
        },
        {
          "name": "component.button",
          "version": "0.4"
        },
        {
          "name": "component.carousel",
          "version": "0.4"
        },
        {
          "name": "component.switch",
          "version": "0.4"
        },
        {
          "name": "component.countdown",
          "version": "0.4"
        },
        {
          "name": "localization.catalogs",
          "version": "0.4"
        },
        {
          "name": "localization.rtl",
          "version": "0.4"
        },
        {
          "name": "localization.productTemplate",
          "version": "0.4"
        },
        {
          "name": "product.references",
          "version": "0.4"
        },
        {
          "name": "asset.bundledImage",
          "version": "0.4"
        },
        {
          "name": "asset.remoteImage",
          "version": "0.4"
        },
        {
          "name": "asset.bundledVideo",
          "version": "0.4"
        },
        {
          "name": "asset.remoteVideo",
          "version": "0.4"
        },
        {
          "name": "action.purchase",
          "version": "0.4"
        },
        {
          "name": "action.restore",
          "version": "0.4"
        },
        {
          "name": "action.close",
          "version": "0.4"
        },
        {
          "name": "action.navigateTo",
          "version": "0.4"
        },
        {
          "name": "action.navigateBack",
          "version": "0.4"
        },
        {
          "name": "action.openExternalUrl",
          "version": "0.4"
        },
        {
          "name": "accessibility.metadata",
          "version": "0.4"
        },
        {
          "name": "accessibility.reservedStrings",
          "version": "0.4"
        },
        {
          "name": "fallback.asset",
          "version": "0.4"
        },
        {
          "name": "fallback.product",
          "version": "0.4"
        },
        {
          "name": "outcome.normalized",
          "version": "0.4"
        },
        {
          "name": "style.colors",
          "version": "0.4"
        },
        {
          "name": "style.designTokens",
          "version": "0.4"
        },
        {
          "name": "style.gradientBackground",
          "version": "0.4"
        },
        {
          "name": "style.mediaBackground",
          "version": "0.4"
        },
        {
          "name": "style.shadow",
          "version": "0.4"
        },
        {
          "name": "style.box",
          "version": "0.4"
        },
        {
          "name": "style.clipping",
          "version": "0.4"
        },
        {
          "name": "style.typography",
          "version": "0.4"
        },
        {
          "name": "visibility.static",
          "version": "0.4"
        },
        {
          "name": "condition.switchVisibility",
          "version": "0.4"
        }
      ]
    },
    "localization": {
      "defaultLocale": "en",
      "fallbackLocale": "en",
      "locales": {
        "en": {
          "direction": "ltr",
          "strings": {
            "paywall.close": "Close",
            "paywall.hero.alt": "A mosaic of native mobile paywall screens",
            "paywall.hero.placeholder": "Premium illustration unavailable",
            "paywall.headline": "Unlock every Mosaic Pro feature",
            "paywall.subtitle": "Build, preview, and improve native paywalls across every supported platform without giving up platform conventions.",
            "paywall.features.label": "Included with Mosaic Pro",
            "paywall.feature.unlimited_projects": "Create unlimited paywall projects",
            "paywall.feature.native_rendering": "Render with native Flutter, SwiftUI, and Compose controls",
            "paywall.feature.offline_ready": "Keep a bundled paywall ready when the network is unavailable",
            "paywall.products.monthly": "Monthly",
            "paywall.products.yearly": "Yearly",
            "paywall.products.best_value": "Best value",
            "paywall.products.label": "Choose a plan",
            "paywall.products.hint": "Select one available subscription plan before continuing",
            "paywall.products.unavailable": "Plans are temporarily unavailable.",
            "paywall.purchase": "Continue",
            "paywall.purchase.progress": "Processing purchase…",
            "paywall.purchase.accessibility": "Continue with the selected plan",
            "paywall.purchase.hint": "Starts the purchase for the selected subscription plan",
            "paywall.restore": "Restore purchases",
            "paywall.restore.progress": "Restoring purchases…",
            "paywall.restore.accessibility": "Restore previous purchases",
            "paywall.restore.hint": "Checks the purchase provider for restorable access",
            "paywall.legal": "Payment is charged to your store account. Subscriptions renew automatically unless cancelled before the end of the current period. Terms and privacy policy apply.",
            "mosaic.migration.product_card_1.name": "{{ product.name }}",
            "mosaic.migration.product_card_2.price": "{{ product.price }}",
            "mosaic.migration.product_card_3.name": "{{ product.name }}",
            "mosaic.migration.product_card_4.price": "{{ product.price }}",
            "paywall.screen.offer": "Subscription offer",
            "paywall.assets.offer_texture_fallback": "Offer background unavailable",
            "paywall.screen.details": "Purchase details",
            "paywall.navigation.details": "Review purchase details",
            "paywall.navigation.details.hint": "Opens the purchase details screen",
            "paywall.navigation.back": "Back to offer",
            "paywall.details.title": "Purchase and policy details",
            "paywall.details.privacy": "Open privacy policy",
            "paywall.details.privacy.hint": "Opens the privacy policy in the system browser",
            "paywall.offer.switch": "Show offer details",
            "paywall.offer.switch.hint": "Shows or hides optional offer content",
            "paywall.offer.technical_switch": "Show technical details",
            "paywall.offer.page_one.label": "Native renderers",
            "paywall.offer.page_one": "One paywall, three native renderers",
            "paywall.offer.page_two.label": "Remote updates",
            "paywall.offer.page_two": "Update without an app release",
            "paywall.offer.carousel": "Offer highlights",
            "paywall.offer.carousel.hint": "Swipe horizontally between offer highlights",
            "paywall.offer.completed": "Offer ended",
            "paywall.offer.countdown.accessibility": "Time remaining for this offer",
            "paywall.products.lifetime": "Lifetime",
            "paywall.products.lifetime_name_template": "{{ product.name }}",
            "paywall.products.lifetime_price_template": "{{ product.price }}",
            "paywall.products.lifetime_accessibility_template": "{{ product.name }}, {{ product.price }}",
            "paywall.products.lifetime_badge": "Own it forever",
            "mosaic.a11y.in_progress": "In progress"
          }
        },
        "de": {
          "direction": "ltr",
          "strings": {
            "paywall.close": "Schließen",
            "paywall.hero.alt": "Ein Mosaik aus nativen mobilen Bezahlschranken",
            "paywall.hero.placeholder": "Premiumillustration ist nicht verfügbar",
            "paywall.headline": "Schalte sämtliche professionellen Funktionen von Mosaic auf allen unterstützten Plattformen frei",
            "paywall.subtitle": "Erstelle, überprüfe und verbessere vollständig native Bezahlschranken für Flutter, SwiftUI und Jetpack Compose, ohne dabei die vertrauten Konventionen, die Barrierefreiheit oder das Verhalten der jeweiligen Plattform aufzugeben.",
            "paywall.features.label": "In Mosaic Pro enthalten",
            "paywall.feature.unlimited_projects": "Erstelle unbegrenzt viele Bezahlschrankenprojekte",
            "paywall.feature.native_rendering": "Nutze native Steuerelemente für Flutter, SwiftUI und Compose",
            "paywall.feature.offline_ready": "Halte bei fehlender Netzwerkverbindung eine gebündelte Bezahlschranke bereit",
            "paywall.products.monthly": "Monatlich",
            "paywall.products.yearly": "Jährlich",
            "paywall.products.best_value": "Bestes Angebot",